id,arabic_text,transcription_en,transcription_fr,translation_en,translation_fr,when_en,when_fr,when_ar,reference_en,reference_fr,reference_ar,tafsir_en,tafsir_fr,tafsir_ar,audio_url,ajr,likes_count,is_active,created_at,updated_at,title_en,title_fr,title_ar,position,title_de,title_nl,title_tr,title_id,title_ur,title_bn,title_ms,transcription_de,transcription_nl,transcription_tr,transcription_id,transcription_ur,transcription_bn,transcription_ms,translation_de,translation_nl,translation_tr,translation_id,translation_ur,translation_bn,translation_ms,when_de,when_nl,when_tr,when_id,when_ur,when_bn,when_ms,reference_de,reference_nl,reference_tr,reference_id,reference_ur,reference_bn,reference_ms,tafsir_de,tafsir_nl,tafsir_tr,tafsir_id,tafsir_ur,tafsir_bn,tafsir_ms,title_ru,transcription_ru,translation_ru,when_ru,reference_ru,tafsir_ru
,بِسْمِ اللّٰهِ الرَّحْمٰنِ الرَّحِيْمِ، اَلْحَمْدُ لِلّٰهِ رَبِّ الْعَالَمِيْنَ، الرَّحْمٰنِ الرَّحِيْمِ، مٰلِكِ يَوْمِ الدِّيْنِ، إِيَّاكَ نَعْبُدُ وَإِيَّاكَ نَسْتَعِيْنُ، اِهْدِنَا الصِّرَاطَ الْمُسْتَقِيْمَ، صِرَاطَ الَّذِيْنَ أَنْعَمْتَ عَلَيْهِمْ غَيْرِ الْمَغْضُوْبِ عَلَيْهِمْ وَلَا الضَّآلِّيْنَ.,"Bismi-llāhi-r-Raḥmāni-r-Raḥīm. Alḥamdu lillāhi Rabbi-l-ʿālamīn, ar-Raḥmāni-r-Raḥīm, Māliki yawmi-d-dīn, iyyāka naʿbudu wa iyyāka nastaʿīn, ihdina-ṣ-Ṣirāṭa-l-Mustaqīm, ṣirāṭa-lladhīna anʿamta ʿalayhim ghayri-l-maghḍūbi ʿalayhim wa la-ḍ-ḍāllīn.","Bismi-llāhi-r-Raḥmāni-r-Raḥīm. Alḥamdu lillāhi Rabbi-l-ʿālamīn, ar-Raḥmāni-r-Raḥīm, Māliki yawmi-d-dīn, iyyāka naʿbudu wa iyyāka nastaʿīn, ihdina-ṣ-Ṣirāṭa-l-Mustaqīm, ṣirāṭa-lladhīna anʿamta ʿalayhim ghayri-l-maghḍūbi ʿalayhim wa la-ḍ-ḍāllīn.","In the name of Allah, the All-Merciful, the Very Merciful. All praises and thanks are for Allah, the Lord of all the worlds, the All-Merciful, the Very Merciful, Master of the Day of Judgement. You Alone we worship, You Alone we ask for help. Guide us on the Straight Path, the path of those whom You have favoured, not of those who incur (Your) anger nor of those who have gone astray.","Au nom d'Allah, le Tout Miséricordieux, le Très Miséricordieux. Louange à Allah, Seigneur de l'univers, le Tout Miséricordieux, le Très Miséricordieux, Maître du Jour de la rétribution. C'est Toi Seul que nous adorons, et c'est Toi Seul dont nous implorons le secours. Guide-nous vers le droit chemin, le chemin de ceux que Tu as comblés de faveurs, non pas de ceux qui ont encouru Ta colère, ni des égarés.","Recited in every unit of every prayer; the most comprehensive supplication, asking Allah for guidance on the Straight Path.","Récitée dans chaque unité de chaque prière ; l'invocation la plus complète, demandant à Allah la guidée sur le droit chemin.",تُقرأ في كل ركعة من كل صلاة؛ وهي أجمع دعاء يسأل العبد فيه ربه الهداية إلى الصراط المستقيم.,Qur'an 1:1-7,Coran 1:1-7,القرآن ١:١-٧,,,,,5,0,true,,,Surah al-Fatihah: The Greatest Du'a,Sourate al-Fatiha : la plus grande invocation,سورة الفاتحة: أعظم دعاء,1,Sure al-Fatiha: Das größte Bittgebet,Soera al-Fatiha: de grootste smeekbede,Fatiha Suresi: En büyük dua,Surah Al-Fatihah: Doa yang paling agung,سورۃ الفاتحہ: سب سے عظیم دعا,সূরা আল-ফাতিহা: সর্বশ্রেষ্ঠ দোয়া,Surah Al-Fatihah: Doa yang teragung,"Bismi-llāhi-r-Raḥmāni-r-Raḥīm. Alḥamdu lillāhi Rabbi-l-ʿālamīn, ar-Raḥmāni-r-Raḥīm, Māliki yawmi-d-dīn, iyyāka naʿbudu wa iyyāka nastaʿīn, ihdina-ṣ-Ṣirāṭa-l-Mustaqīm, ṣirāṭa-lladhīna anʿamta ʿalayhim ghayri-l-maghḍūbi ʿalayhim wa la-ḍ-ḍāllīn.","Bismi-llāhi-r-Raḥmāni-r-Raḥīm. Alḥamdu lillāhi Rabbi-l-ʿālamīn, ar-Raḥmāni-r-Raḥīm, Māliki yawmi-d-dīn, iyyāka naʿbudu wa iyyāka nastaʿīn, ihdina-ṣ-Ṣirāṭa-l-Mustaqīm, ṣirāṭa-lladhīna anʿamta ʿalayhim ghayri-l-maghḍūbi ʿalayhim wa la-ḍ-ḍāllīn.","Bismi-llāhi-r-Raḥmāni-r-Raḥīm. Alḥamdu lillāhi Rabbi-l-ʿālamīn, ar-Raḥmāni-r-Raḥīm, Māliki yawmi-d-dīn, iyyāka naʿbudu wa iyyāka nastaʿīn, ihdina-ṣ-Ṣirāṭa-l-Mustaqīm, ṣirāṭa-lladhīna anʿamta ʿalayhim ghayri-l-maghḍūbi ʿalayhim wa la-ḍ-ḍāllīn.","Bismi-llāhi-r-Raḥmāni-r-Raḥīm. Alḥamdu lillāhi Rabbi-l-ʿālamīn, ar-Raḥmāni-r-Raḥīm, Māliki yawmi-d-dīn, iyyāka naʿbudu wa iyyāka nastaʿīn, ihdina-ṣ-Ṣirāṭa-l-Mustaqīm, ṣirāṭa-lladhīna anʿamta ʿalayhim ghayri-l-maghḍūbi ʿalayhim wa la-ḍ-ḍāllīn.","Bismi-llāhi-r-Raḥmāni-r-Raḥīm. Alḥamdu lillāhi Rabbi-l-ʿālamīn, ar-Raḥmāni-r-Raḥīm, Māliki yawmi-d-dīn, iyyāka naʿbudu wa iyyāka nastaʿīn, ihdina-ṣ-Ṣirāṭa-l-Mustaqīm, ṣirāṭa-lladhīna anʿamta ʿalayhim ghayri-l-maghḍūbi ʿalayhim wa la-ḍ-ḍāllīn.","Bismi-llāhi-r-Raḥmāni-r-Raḥīm. Alḥamdu lillāhi Rabbi-l-ʿālamīn, ar-Raḥmāni-r-Raḥīm, Māliki yawmi-d-dīn, iyyāka naʿbudu wa iyyāka nastaʿīn, ihdina-ṣ-Ṣirāṭa-l-Mustaqīm, ṣirāṭa-lladhīna anʿamta ʿalayhim ghayri-l-maghḍūbi ʿalayhim wa la-ḍ-ḍāllīn.","Bismi-llāhi-r-Raḥmāni-r-Raḥīm. Alḥamdu lillāhi Rabbi-l-ʿālamīn, ar-Raḥmāni-r-Raḥīm, Māliki yawmi-d-dīn, iyyāka naʿbudu wa iyyāka nastaʿīn, ihdina-ṣ-Ṣirāṭa-l-Mustaqīm, ṣirāṭa-lladhīna anʿamta ʿalayhim ghayri-l-maghḍūbi ʿalayhim wa la-ḍ-ḍāllīn.","Im Namen Allahs, des Allerbarmers, des Barmherzigen. Alles Lob gebührt Allah, dem Herrn der Welten, dem Allerbarmer, dem Barmherzigen, dem Herrscher am Tag des Gerichts. Dir allein dienen wir, und Dich allein bitten wir um Hilfe. Leite uns den geraden Weg, den Weg derer, denen Du Gnade erwiesen hast, nicht derer, die Deinen Zorn erregt haben, und nicht der Irregehenden.","In de naam van Allah, de Erbarmer, de Meest Barmhartige. Alle lof zij Allah, de Heer der werelden, de Erbarmer, de Meest Barmhartige, Meester van de Dag des Oordeels. U alleen aanbidden wij en U alleen vragen wij om hulp. Leid ons op het rechte pad, het pad van hen aan wie U gunsten hebt geschonken, niet van hen op wie de toorn rust, noch van de dwalenden.","Rahman ve Rahim olan Allah'ın adıyla. Hamd, âlemlerin Rabbi olan Allah'a mahsustur. O Rahman ve Rahim'dir. Din gününün sahibidir. Yalnız Sana ibadet eder ve yalnız Senden yardım dileriz. Bizi dosdoğru yola ilet; kendilerine nimet verdiklerinin yoluna, gazaba uğrayanların ve sapkınların yoluna değil.","Dengan nama Allah Yang Maha Pengasih, Maha Penyayang. Segala puji bagi Allah, Tuhan seluruh alam, Yang Maha Pengasih, Maha Penyayang, Pemilik hari pembalasan. Hanya kepada Engkau kami menyembah dan hanya kepada Engkau kami memohon pertolongan. Tunjukilah kami jalan yang lurus, jalan orang-orang yang telah Engkau beri nikmat, bukan jalan mereka yang dimurkai dan bukan pula jalan mereka yang sesat.",اللہ کے نام سے جو نہایت مہربان، رحم کرنے والا ہے۔ تمام تعریفیں اللہ کے لیے ہیں جو تمام جہانوں کا رب ہے، نہایت مہربان، رحم کرنے والا، روزِ جزا کا مالک۔ ہم تیری ہی عبادت کرتے ہیں اور تجھ ہی سے مدد مانگتے ہیں۔ ہمیں سیدھے راستے کی ہدایت دے، اُن لوگوں کے راستے کی جن پر تو نے انعام کیا، نہ اُن کے جن پر غضب ہوا اور نہ گمراہوں کے۔,"পরম করুণাময় অসীম দয়ালু আল্লাহর নামে। সমস্ত প্রশংসা আল্লাহর জন্য, যিনি সকল জগতের প্রতিপালক, পরম করুণাময়, অসীম দয়ালু, বিচার দিনের মালিক। আমরা কেবল তোমারই ইবাদত করি এবং কেবল তোমারই সাহায্য প্রার্থনা করি। আমাদের সরল পথ দেখাও, তাদের পথ যাদের তুমি অনুগ্রহ দান করেছ, তাদের নয় যাদের উপর তোমার ক্রোধ এবং পথভ্রষ্টদেরও নয়।","Dengan nama Allah Yang Maha Pemurah, Maha Penyayang. Segala puji bagi Allah, Tuhan sekalian alam, Yang Maha Pemurah, Maha Penyayang, Yang Menguasai hari pembalasan. Hanya Engkau yang kami sembah dan hanya kepada Engkau kami memohon pertolongan. Tunjukilah kami jalan yang lurus, jalan orang-orang yang Engkau kurniakan nikmat, bukan jalan mereka yang dimurkai dan bukan pula jalan mereka yang sesat.","Wird in jeder Gebetseinheit gesprochen; das umfassendste Bittgebet, das Allah um Rechtleitung auf dem geraden Weg bittet.","Wordt in elke gebedseenheid gereciteerd; de meest omvattende smeekbede, waarin men Allah om leiding op het rechte pad vraagt.",Her namazın her rekâtında okunur; kulun Rabbinden dosdoğru yola hidayet dilediği en kapsamlı duadır.,"Dibaca pada setiap rakaat dalam setiap salat; doa yang paling lengkap, memohon kepada Allah petunjuk ke jalan yang lurus.",ہر نماز کی ہر رکعت میں پڑھی جاتی ہے؛ یہ سب سے جامع دعا ہے جس میں بندہ اپنے رب سے سیدھے راستے کی ہدایت مانگتا ہے۔,"প্রতিটি নামাজের প্রতি রাকাতে পড়া হয়; এটি সবচেয়ে পূর্ণাঙ্গ দোয়া, যাতে বান্দা তার রবের কাছে সরল পথের হিদায়াত চায়।","Dibaca pada setiap rakaat dalam setiap solat; doa yang paling menyeluruh, memohon kepada Allah hidayah ke jalan yang lurus.",Koran 1:1-7,Koran 1:1-7,Kur'an 1:1-7,Al-Qur'an 1:1-7,قرآن ۱:۱-۷,কুরআন ১:১-৭,Al-Quran 1:1-7,,,,,,,,Сура аль-Фатиха: величайшая мольба,"Bismi-llāhi-r-Raḥmāni-r-Raḥīm. Alḥamdu lillāhi Rabbi-l-ʿālamīn, ar-Raḥmāni-r-Raḥīm, Māliki yawmi-d-dīn, iyyāka naʿbudu wa iyyāka nastaʿīn, ihdina-ṣ-Ṣirāṭa-l-Mustaqīm, ṣirāṭa-lladhīna anʿamta ʿalayhim ghayri-l-maghḍūbi ʿalayhim wa la-ḍ-ḍāllīn.","Во имя Аллаха, Милостивого, Милосердного. Хвала Аллаху, Господу миров, Милостивому, Милосердному, Властелину Дня воздаяния. Тебе одному мы поклоняемся и Тебя одного молим о помощи. Веди нас прямым путём, путём тех, кого Ты облагодетельствовал, не тех, на кого пал гнев, и не заблудших.",Читается в каждом ракаате каждой молитвы; самая всеобъемлющая мольба о наставлении на прямой путь.,Коран 1:1-7,
,لَآ إِلٰهَ إِلَّآ أَنْتَ سُبْحَانَكَ إِنِّيْ كُنْتُ مِنَ الظَّالِمِيْنَ.,Lā ilāha illā Anta subḥānaka innī kuntu mina-ẓ-ẓālimīn.,Lā ilāha illā Anta subḥānaka innī kuntu mina-ẓ-ẓālimīn.,"There is no god worthy of worship except You. You are free from imperfection. Indeed, I have been of the wrongdoers.",Il n'y a de divinité digne d'adoration que Toi. Gloire et pureté à Toi ! J'ai vraiment été du nombre des injustes.,"Recite in times of distress, hardship and grief; the supplication by which Allah relieved Yunus ﷺ from the belly of the fish.","À réciter dans les moments de détresse, d'épreuve et de chagrin ; l'invocation par laquelle Allah délivra Yunus ﷺ du ventre du poisson.",يُدعى بها عند الكرب والشدة والحزن؛ وهي الدعوة التي فرّج الله بها عن يونس عليه السلام في بطن الحوت.,Qur'an 21:87,Coran 21:87,القرآن ٢١:٨٧,,,,,5,0,true,,,Du'a of the Grief-stricken Prophet Yunus ﷺ,Invocation du Prophète Yunus ﷺ accablé de chagrin,دعاء النبي يونس عليه السلام في كربه,2,Bittgebet des kummervollen Propheten Yunus ﷺ,Smeekbede van de bedroefde profeet Yunus ﷺ,Kederli Peygamber Yunus'un ﷺ duası,Doa Nabi Yunus ﷺ yang sedang berduka,غم زدہ نبی یونس علیہ السلام کی دعا,দুঃখভারাক্রান্ত নবী ইউনুস ﷺ-এর দোয়া,Doa Nabi Yunus ﷺ yang dirundung kesedihan,Lā ilāha illā Anta subḥānaka innī kuntu mina-ẓ-ẓālimīn.,Lā ilāha illā Anta subḥānaka innī kuntu mina-ẓ-ẓālimīn.,Lā ilāha illā Anta subḥānaka innī kuntu mina-ẓ-ẓālimīn.,Lā ilāha illā Anta subḥānaka innī kuntu mina-ẓ-ẓālimīn.,Lā ilāha illā Anta subḥānaka innī kuntu mina-ẓ-ẓālimīn.,Lā ilāha illā Anta subḥānaka innī kuntu mina-ẓ-ẓālimīn.,Lā ilāha illā Anta subḥānaka innī kuntu mina-ẓ-ẓālimīn.,"Es gibt keinen Gott außer Dir, der angebetet zu werden verdient. Gepriesen seist Du! Wahrlich, ich gehörte zu den Ungerechten.","Er is geen god die aanbidding waardig is behalve U. Verheven bent U! Voorwaar, ik behoorde tot de onrechtplegers.",Senden başka ibadete lâyık ilah yoktur. Sen her türlü eksiklikten münezzehsin. Şüphesiz ben zalimlerden oldum.,"Tidak ada tuhan yang berhak disembah selain Engkau. Maha Suci Engkau. Sungguh, aku termasuk orang-orang yang zalim.",تیرے سوا کوئی معبود نہیں، تو پاک ہے، بے شک میں ظالموں میں سے تھا۔,"তুমি ছাড়া কোনো উপাস্য নেই, তুমি পবিত্র, নিশ্চয়ই আমি সীমালঙ্ঘনকারীদের অন্তর্ভুক্ত ছিলাম।",Tiada tuhan yang berhak disembah melainkan Engkau. Maha Suci Engkau. Sesungguhnya aku termasuk orang-orang yang zalim.,"In Zeiten von Not, Bedrängnis und Kummer zu sprechen; das Bittgebet, mit dem Allah Yunus ﷺ aus dem Bauch des Fisches errettete.","Te reciteren in tijden van nood, beproeving en verdriet; de smeekbede waarmee Allah Yunus ﷺ uit de buik van de vis verloste.","Sıkıntı, darlık ve keder anlarında okunur; Allah'ın, Yunus'u ﷺ balığın karnından kurtardığı duadır.","Dibaca saat kesusahan, kesempitan, dan kesedihan; doa yang dengannya Allah menyelamatkan Yunus ﷺ dari perut ikan.",تنگی، مصیبت اور غم کے وقت پڑھیں؛ یہی وہ دعا ہے جس سے اللہ نے یونس علیہ السلام کو مچھلی کے پیٹ سے نجات دی۔,"বিপদ, কষ্ট ও দুঃখের সময় পড়ুন; এই দোয়ার মাধ্যমেই আল্লাহ ইউনুস ﷺ-কে মাছের পেট থেকে মুক্তি দিয়েছিলেন।","Dibaca ketika kesusahan, kesempitan dan kesedihan; doa yang dengannya Allah menyelamatkan Yunus ﷺ dari perut ikan.",Koran 21:87,Koran 21:87,Kur'an 21:87,Al-Qur'an 21:87,قرآن ۲۱:۸۷,কুরআন ২১:৮৭,Al-Quran 21:87,,,,,,,,Мольба опечаленного пророка Юнуса ﷺ,Lā ilāha illā Anta subḥānaka innī kuntu mina-ẓ-ẓālimīn.,"Нет божества, достойного поклонения, кроме Тебя. Пречист Ты! Воистину, я был одним из беззаконников.","Читается во времена скорби, тягот и печали; мольба, которой Аллах избавил Юнуса ﷺ из чрева кита.",Коран 21:87,
,رَبِّ إِنِّيْ ظَلَمْتُ نَفْسِيْ فَاغْفِرْ لِيْ.,Rabbi innī ẓalamtu nafsī fa-ghfir lī.,Rabbi innī ẓalamtu nafsī fa-ghfir lī.,"My Lord, I have certainly wronged myself, so forgive me.","Mon Seigneur, je me suis vraiment fait du tort à moi-même ; pardonne-moi donc.",A concise plea for forgiveness whenever you realise you have wronged yourself through sin.,Une demande concise de pardon dès que l'on réalise s'être fait du tort par le péché.,دعاء موجز للمغفرة عند إدراك العبد أنه ظلم نفسه بالذنب.,Qur'an 28:16,Coran 28:16,القرآن ٢٨:١٦,,,,,5,0,true,,,Du'a of Prophet Musa ﷺ for Forgiveness,Invocation du Prophète Musa ﷺ pour le pardon,دعاء النبي موسى عليه السلام للمغفرة,3,Bittgebet des Propheten Musa ﷺ um Vergebung,Smeekbede van profeet Musa ﷺ om vergeving,Peygamber Musa'nın ﷺ bağışlanma duası,Doa Nabi Musa ﷺ memohon ampunan,نبی موسیٰ علیہ السلام کی مغفرت کی دعا,নবী মূসা ﷺ-এর ক্ষমা প্রার্থনার দোয়া,Doa Nabi Musa ﷺ memohon keampunan,Rabbi innī ẓalamtu nafsī fa-ghfir lī.,Rabbi innī ẓalamtu nafsī fa-ghfir lī.,Rabbi innī ẓalamtu nafsī fa-ghfir lī.,Rabbi innī ẓalamtu nafsī fa-ghfir lī.,Rabbi innī ẓalamtu nafsī fa-ghfir lī.,Rabbi innī ẓalamtu nafsī fa-ghfir lī.,Rabbi innī ẓalamtu nafsī fa-ghfir lī.,"Mein Herr, ich habe mir selbst Unrecht getan, so vergib mir.","Mijn Heer, ik heb mijzelf werkelijk onrecht aangedaan, vergeef mij dus.",Rabbim! Şüphesiz ben kendime zulmettim; beni bağışla.,"Ya Tuhanku, sesungguhnya aku telah menzalimi diriku sendiri, maka ampunilah aku.",اے میرے رب! بے شک میں نے اپنی جان پر ظلم کیا، پس مجھے بخش دے۔,"হে আমার রব! নিশ্চয়ই আমি নিজের প্রতি জুলুম করেছি, তাই আমাকে ক্ষমা করো।","Wahai Tuhanku! Sesungguhnya aku telah menzalimi diriku sendiri, maka ampunilah aku.","Eine knappe Bitte um Vergebung, sobald man erkennt, sich durch Sünde selbst Unrecht getan zu haben.",Een beknopte bede om vergeving wanneer je beseft dat je jezelf door zonde onrecht hebt aangedaan.,Günah ile kendine zulmettiğini fark ettiğin her an okunan kısa bir bağışlanma duası.,Permohonan ampun yang ringkas ketika menyadari telah menzalimi diri dengan dosa.,جب بھی محسوس ہو کہ گناہ سے اپنی جان پر ظلم کیا، یہ مختصر دعا مغفرت کے لیے پڑھیں۔,"যখনই উপলব্ধি হয় যে পাপের মাধ্যমে নিজের প্রতি জুলুম করেছেন, তখন ক্ষমা চাওয়ার সংক্ষিপ্ত এই দোয়া পড়ুন।",Permohonan ampun yang ringkas apabila menyedari diri telah dizalimi dengan dosa.,Koran 28:16,Koran 28:16,Kur'an 28:16,Al-Qur'an 28:16,قرآن ۲۸:۱۶,কুরআন ২৮:১৬,Al-Quran 28:16,,,,,,,,Мольба пророка Мусы ﷺ о прощении,Rabbi innī ẓalamtu nafsī fa-ghfir lī.,"Господи! Я поступил несправедливо по отношению к себе, прости же меня.","Краткая просьба о прощении всякий раз, когда осознаёшь, что согрешил против себя.",Коран 28:16,
,رَبَّنَا ظَلَمْنَآ أَنْفُسَنَا وَإِنْ لَّمْ تَغْفِرْ لَنَا وَتَرْحَمْنَا لَنَكُوْنَنَّ مِنَ الْخٰسِرِيْنَ.,Rabbanā ẓalamnā anfusanā wa il-lam taghfir lanā wa tarḥamnā la-nakūnanna mina-l-khāsirīn.,Rabbanā ẓalamnā anfusanā wa il-lam taghfir lanā wa tarḥamnā la-nakūnanna mina-l-khāsirīn.,"Our Lord, we have wronged ourselves. If You do not forgive us and have mercy upon us, we will surely be amongst the losers.","Notre Seigneur, nous nous sommes fait du tort à nous-mêmes. Si Tu ne nous pardonnes pas et ne nous fais pas miséricorde, nous serons assurément parmi les perdants.","The repentance of Adam ﷺ — recite when seeking forgiveness after a slip, acknowledging your need for Allah's mercy.","Le repentir d'Adam ﷺ — à réciter pour demander pardon après une faute, en reconnaissant son besoin de la miséricorde d'Allah.",توبة آدم عليه السلام؛ تُقال عند طلب المغفرة بعد الزلل واعترافًا بالحاجة إلى رحمة الله.,Qur'an 7:23,Coran 7:23,القرآن ٧:٢٣,,,,,5,0,true,,,Du'a of Prophet Adam ﷺ and Hawwa for Forgiveness,Invocation du Prophète Adam ﷺ et de Hawwa pour le pardon,دعاء آدم عليه السلام وحواء للمغفرة,4,Bittgebet des Propheten Adam ﷺ und Hawwas um Vergebung,Smeekbede van profeet Adam ﷺ en Hawwa om vergeving,Peygamber Âdem ﷺ ile Havva'nın bağışlanma duası,Doa Nabi Adam ﷺ dan Hawa memohon ampunan,نبی آدم علیہ السلام اور حوا کی مغفرت کی دعا,নবী আদম ﷺ ও হাওয়ার ক্ষমা প্রার্থনার দোয়া,Doa Nabi Adam ﷺ dan Hawa memohon keampunan,Rabbanā ẓalamnā anfusanā wa il-lam taghfir lanā wa tarḥamnā la-nakūnanna mina-l-khāsirīn.,Rabbanā ẓalamnā anfusanā wa il-lam taghfir lanā wa tarḥamnā la-nakūnanna mina-l-khāsirīn.,Rabbanā ẓalamnā anfusanā wa il-lam taghfir lanā wa tarḥamnā la-nakūnanna mina-l-khāsirīn.,Rabbanā ẓalamnā anfusanā wa il-lam taghfir lanā wa tarḥamnā la-nakūnanna mina-l-khāsirīn.,Rabbanā ẓalamnā anfusanā wa il-lam taghfir lanā wa tarḥamnā la-nakūnanna mina-l-khāsirīn.,Rabbanā ẓalamnā anfusanā wa il-lam taghfir lanā wa tarḥamnā la-nakūnanna mina-l-khāsirīn.,Rabbanā ẓalamnā anfusanā wa il-lam taghfir lanā wa tarḥamnā la-nakūnanna mina-l-khāsirīn.,"Unser Herr, wir haben uns selbst Unrecht getan. Wenn Du uns nicht vergibst und Dich unser nicht erbarmst, werden wir gewiss zu den Verlierern gehören.","Onze Heer, wij hebben onszelf onrecht aangedaan. Als U ons niet vergeeft en U niet over ons ontfermt, zullen wij zeker tot de verliezers behoren.","Rabbimiz! Biz kendimize zulmettik. Eğer bizi bağışlamaz ve bize merhamet etmezsen, mutlaka hüsrana uğrayanlardan oluruz.","Ya Tuhan kami, kami telah menzalimi diri kami sendiri. Jika Engkau tidak mengampuni kami dan memberi rahmat kepada kami, niscaya kami termasuk orang-orang yang rugi.",اے ہمارے رب! ہم نے اپنی جانوں پر ظلم کیا، اور اگر تو نے ہمیں نہ بخشا اور ہم پر رحم نہ کیا تو ہم ضرور نقصان اٹھانے والوں میں سے ہو جائیں گے۔,"হে আমাদের রব! আমরা নিজেদের প্রতি জুলুম করেছি; যদি তুমি আমাদের ক্ষমা না করো এবং দয়া না করো, তবে নিশ্চয়ই আমরা ক্ষতিগ্রস্তদের অন্তর্ভুক্ত হব।","Wahai Tuhan kami, kami telah menzalimi diri kami sendiri. Jika Engkau tidak mengampuni kami dan mengasihani kami, nescaya kami termasuk orang-orang yang rugi.","Die Reue Adams ﷺ — zu sprechen, wenn man nach einem Fehltritt um Vergebung bittet und seine Bedürftigkeit nach Allahs Barmherzigkeit anerkennt.",Het berouw van Adam ﷺ — te reciteren wanneer je na een misstap om vergeving vraagt en je behoefte aan Allahs genade erkent.,Âdem'in ﷺ tövbesi — bir hatadan sonra Allah'ın rahmetine olan ihtiyacını kabul ederek bağışlanma dilerken okunur.,"Tobat Adam ﷺ — dibaca saat memohon ampun setelah tergelincir, mengakui kebutuhan akan rahmat Allah.",آدم علیہ السلام کی توبہ؛ کسی لغزش کے بعد اللہ کی رحمت کی محتاجی کا اعتراف کرتے ہوئے مغفرت طلب کرتے وقت پڑھیں۔,আদম ﷺ-এর তওবা; কোনো ভুলের পর আল্লাহর রহমতের মুখাপেক্ষিতা স্বীকার করে ক্ষমা চাওয়ার সময় পড়ুন।,"Taubat Adam ﷺ — dibaca ketika memohon ampun selepas tergelincir, mengakui keperluan kepada rahmat Allah.",Koran 7:23,Koran 7:23,Kur'an 7:23,Al-Qur'an 7:23,قرآن ۷:۲۳,কুরআন ৭:২৩,Al-Quran 7:23,,,,,,,,Мольба пророка Адама ﷺ и Хаввы о прощении,Rabbanā ẓalamnā anfusanā wa il-lam taghfir lanā wa tarḥamnā la-nakūnanna mina-l-khāsirīn.,"Господь наш! Мы поступили несправедливо по отношению к себе, и если Ты не простишь нас и не помилуешь, то мы непременно окажемся среди потерпевших урон.","Покаяние Адама ﷺ — читается при просьбе о прощении после оплошности, признавая нужду в милости Аллаха.",Коран 7:23,
