id,arabic_text,transcription_en,transcription_fr,translation_en,translation_fr,when_en,when_fr,when_ar,reference_en,reference_fr,reference_ar,tafsir_en,tafsir_fr,tafsir_ar,audio_url,ajr,likes_count,is_active,created_at,updated_at,title_en,title_fr,title_ar,position,title_de,title_nl,title_tr,title_id,title_ur,title_bn,title_ms,transcription_de,transcription_nl,transcription_tr,transcription_id,transcription_ur,transcription_bn,transcription_ms,translation_de,translation_nl,translation_tr,translation_id,translation_ur,translation_bn,translation_ms,when_de,when_nl,when_tr,when_id,when_ur,when_bn,when_ms,reference_de,reference_nl,reference_tr,reference_id,reference_ur,reference_bn,reference_ms,tafsir_de,tafsir_nl,tafsir_tr,tafsir_id,tafsir_ur,tafsir_bn,tafsir_ms,title_ru,transcription_ru,translation_ru,when_ru,reference_ru,tafsir_ru
,رَبِّ لَا تَذَرْنِيْ فَرْدًا وَّأَنْتَ خَيْرُ الْوٰرِثِيْنَ.,Rabbi lā tadharnī fardaw-wa Anta khayru-l-wārithīn.,Rabbi lā tadharnī fardaw-wa Anta khayru-l-wārithīn.,"My Lord, do not leave me childless, though You are the best of inheritors.","Mon Seigneur, ne me laisse pas seul sans descendance, alors que Tu es le meilleur des héritiers.","Recite when yearning for offspring, entrusting the matter to Allah, the best of inheritors.","À réciter en aspirant à une descendance, en confiant l'affaire à Allah, le meilleur des héritiers.",يُدعى بها عند الرغبة في الولد، تفويضًا للأمر إلى الله خير الوارثين.,Qur'an 21:89,Coran 21:89,القرآن ٢١:٨٩,,,,,5,0,true,,,Du'a of Zakariyya ﷺ for Children,Invocation de Zakariyya ﷺ pour une descendance,دعاء زكريا عليه السلام للولد,24,Bittgebet Zakariyyas ﷺ um Kinder,Smeekbede van Zakariyya ﷺ om kinderen,Zekeriya'nın ﷺ evlat duası,Doa Zakariya ﷺ memohon keturunan,زکریا علیہ السلام کی اولاد کی دعا,যাকারিয়া ﷺ-এর সন্তানের দোয়া,Doa Zakaria ﷺ memohon zuriat,Rabbi lā tadharnī fardaw-wa Anta khayru-l-wārithīn.,Rabbi lā tadharnī fardaw-wa Anta khayru-l-wārithīn.,Rabbi lā tadharnī fardaw-wa Anta khayru-l-wārithīn.,Rabbi lā tadharnī fardaw-wa Anta khayru-l-wārithīn.,Rabbi lā tadharnī fardaw-wa Anta khayru-l-wārithīn.,Rabbi lā tadharnī fardaw-wa Anta khayru-l-wārithīn.,Rabbi lā tadharnī fardaw-wa Anta khayru-l-wārithīn.,"Mein Herr, lass mich nicht kinderlos, wo Du doch der beste Erbe bist.","Mijn Heer, laat mij niet kinderloos achter, terwijl U de beste der erfgenamen bent.",Rabbim! Beni tek başıma (evlatsız) bırakma; Sen varislerin en hayırlısısın.,"Ya Tuhanku, janganlah Engkau biarkan aku hidup seorang diri (tanpa keturunan), dan Engkaulah ahli waris yang terbaik.",اے میرے رب! مجھے اکیلا (بے اولاد) نہ چھوڑ، اور تو سب سے بہتر وارث ہے۔,"হে আমার রব! আমাকে একা (নিঃসন্তান) রেখো না, আর তুমিই শ্রেষ্ঠ উত্তরাধিকারী।","Wahai Tuhanku! Janganlah Engkau biarkan aku seorang diri (tanpa zuriat), dan Engkaulah sebaik-baik waris.","Zu sprechen im Verlangen nach Nachkommen, die Angelegenheit Allah, dem besten Erben, anvertrauend.","Te reciteren bij verlangen naar nageslacht, de zaak toevertrouwend aan Allah, de beste der erfgenamen.","Evlat özlemiyle, işi varislerin en hayırlısı olan Allah'a havale ederek okunur.","Dibaca saat mendambakan keturunan, menyerahkan urusan kepada Allah sebaik-baik pewaris.",اولاد کی تڑپ میں پڑھیں، معاملہ خیر الوارثین اللہ کے سپرد کرتے ہوئے۔,"সন্তানের আকাঙ্ক্ষায় পড়ুন, বিষয়টি শ্রেষ্ঠ উত্তরাধিকারী আল্লাহর কাছে সঁপে দিয়ে।","Dibaca ketika mendambakan zuriat, menyerahkan urusan kepada Allah sebaik-baik waris.",Koran 21:89,Koran 21:89,Kur'an 21:89,Al-Qur'an 21:89,قرآن ۲۱:۸۹,কুরআন ২১:৮৯,Al-Quran 21:89,,,,,,,,Мольба Закарии ﷺ о детях,Rabbi lā tadharnī fardaw-wa Anta khayru-l-wārithīn.,"Господи! Не оставляй меня одиноким (бездетным), ведь Ты — Наилучший из наследующих.","Читается при стремлении к потомству, вверяя дело Аллаху, Лучшему из наследующих.",Коран 21:89,
,رَبَّنَا هَبْ لَنَا مِنْ أَزْوَاجِنَا وَذُرِّيَّاتِنَا قُرَّةَ أَعْيُنٍ وَّاجْعَلْنَا لِلْمُتَّقِيْنَ إِمَامًا.,Rabbanā hab lanā min azwājinā wa dhurriyyātinā qurrata aʿyuniw-wajʿalnā lil-muttaqīna imāmā.,Rabbanā hab lanā min azwājinā wa dhurriyyātinā qurrata aʿyuniw-wajʿalnā lil-muttaqīna imāmā.,"Our Lord, grant us spouses and offspring who will be a joy to our eyes, and make us leaders of those who have taqwa (piety).","Notre Seigneur, accorde-nous des épouses et des descendants qui réjouissent nos yeux, et fais de nous des guides pour les pieux.","A supplication of the true servants of the Most Merciful; recite for a righteous, harmonious family that brings comfort to the eyes.","Une invocation des vrais serviteurs du Tout Miséricordieux ; à réciter pour une famille vertueuse et harmonieuse, source de réconfort.",دعاء عباد الرحمن؛ يُقال طلبًا لأسرة صالحة متآلفة تقر بها العيون.,Qur'an 25:74,Coran 25:74,القرآن ٢٥:٧٤,,,,,5,0,true,,,Du'a for a Joyous Household,Invocation pour un foyer source de joie,دعاء لبيت تقر به العيون,25,Bittgebet für ein frohes Zuhause,Smeekbede om een vreugdevol gezin,Mutlu bir yuva için dua,Doa untuk keluarga yang membahagiakan,خوش گوار گھرانے کی دعا,আনন্দময় পরিবারের দোয়া,Doa untuk keluarga yang membahagiakan,Rabbanā hab lanā min azwājinā wa dhurriyyātinā qurrata aʿyuniw-wajʿalnā lil-muttaqīna imāmā.,Rabbanā hab lanā min azwājinā wa dhurriyyātinā qurrata aʿyuniw-wajʿalnā lil-muttaqīna imāmā.,Rabbanā hab lanā min azwājinā wa dhurriyyātinā qurrata aʿyuniw-wajʿalnā lil-muttaqīna imāmā.,Rabbanā hab lanā min azwājinā wa dhurriyyātinā qurrata aʿyuniw-wajʿalnā lil-muttaqīna imāmā.,Rabbanā hab lanā min azwājinā wa dhurriyyātinā qurrata aʿyuniw-wajʿalnā lil-muttaqīna imāmā.,Rabbanā hab lanā min azwājinā wa dhurriyyātinā qurrata aʿyuniw-wajʿalnā lil-muttaqīna imāmā.,Rabbanā hab lanā min azwājinā wa dhurriyyātinā qurrata aʿyuniw-wajʿalnā lil-muttaqīna imāmā.,"Unser Herr, schenke uns an unseren Gattinnen und Nachkommen Freude unserer Augen und mache uns zu Vorbildern für die Gottesfürchtigen.","Onze Heer, schenk ons echtgenoten en nakomelingen die een vreugde voor onze ogen zijn, en maak ons tot leiders van de godvrezenden.",Rabbimiz! Bize eşlerimizden ve neslimizden göz aydınlığı olacak (çocuklar) bağışla ve bizi takvâ sahiplerine önder eyle.,"Ya Tuhan kami, anugerahkanlah kepada kami pasangan dan keturunan kami sebagai penyejuk mata, dan jadikanlah kami pemimpin bagi orang-orang yang bertakwa.",اے ہمارے رب! ہمیں ہماری بیویوں اور اولاد سے آنکھوں کی ٹھنڈک عطا فرما اور ہمیں پرہیزگاروں کا پیشوا بنا۔,হে আমাদের রব! আমাদের স্ত্রী ও সন্তানদের আমাদের চোখের শীতলতা বানাও এবং আমাদের মুত্তাকিদের নেতা বানাও।,"Wahai Tuhan kami, kurniakanlah kepada kami pasangan dan zuriat sebagai penyejuk mata, dan jadikanlah kami pemimpin bagi orang-orang yang bertakwa.","Ein Bittgebet der wahren Diener des Allerbarmers; zu sprechen für eine rechtschaffene, harmonische Familie, die das Auge erfreut.","Een smeekbede van de ware dienaren van de Erbarmer; te reciteren voor een vroom, harmonieus gezin dat troost voor de ogen biedt.","Rahmân'ın gerçek kullarının duası; salih ve huzurlu, göz aydınlığı bir aile için okunur.",Doa hamba-hamba sejati Ar-Rahman; dibaca memohon keluarga yang saleh dan harmonis sebagai penyejuk mata.,رحمٰن کے سچے بندوں کی دعا؛ نیک، باہم محبت والے اور آنکھوں کی ٹھنڈک بننے والے گھرانے کے لیے پڑھیں۔,"পরম করুণাময়ের প্রকৃত বান্দাদের দোয়া; নেক, সম্প্রীতিময় ও চোখের শীতলতা পরিবারের জন্য পড়ুন।",Doa hamba-hamba sejati Ar-Rahman; dibaca memohon keluarga yang soleh dan harmoni sebagai penyejuk mata.,Koran 25:74,Koran 25:74,Kur'an 25:74,Al-Qur'an 25:74,قرآن ۲۵:۷۴,কুরআন ২৫:৭৪,Al-Quran 25:74,,,,,,,,Мольба о радостной семье,Rabbanā hab lanā min azwājinā wa dhurriyyātinā qurrata aʿyuniw-wajʿalnā lil-muttaqīna imāmā.,Господь наш! Даруй нам в супругах и потомках отраду глаз и сделай нас предводителями богобоязненных.,"Мольба истинных рабов Милостивого; читается ради праведной, дружной семьи, что радует глаз.",Коран 25:74,
,رَبِّ أَعُوْذُ بِكَ مِنْ هَمَزَاتِ الشَّيَاطِيْنِ ، وَأَعُوْذُ بِكَ رَبِّ أَنْ يَّحْضُرُوْنِ.,Rabbi aʿūdhu bika min hamazāti-sh-shayāṭīn. Wa aʿūdhu bika Rabbi ay-yaḥḍurūn.,Rabbi aʿūdhu bika min hamazāti-sh-shayāṭīn. Wa aʿūdhu bika Rabbi ay-yaḥḍurūn.,"My Lord, I seek protection with You from the promptings of the devils; and I seek protection in You, my Lord, from their coming near me.","Mon Seigneur, je cherche refuge auprès de Toi contre les incitations des démons ; et je cherche refuge auprès de Toi, mon Seigneur, contre leur présence à mes côtés.","Recite for protection from satanic whisperings, especially when feeling anger, doubt, or evil promptings.","À réciter pour se protéger des murmures sataniques, surtout en cas de colère, de doute ou de mauvaises incitations.",يُدعى بها للتحصن من وساوس الشيطان، ولا سيما عند الغضب أو الشك أو الخواطر السيئة.,Qur'an 23:97-98,Coran 23:97-98,القرآن ٢٣:٩٧-٩٨,,,,,5,0,true,,,Du'a for Seeking Protection from Shaytan,Invocation pour se protéger de Satan,دعاء للاستعاذة من الشيطان,26,Bittgebet um Schutz vor dem Satan,Smeekbede om bescherming tegen de Satan,Şeytandan korunmak için dua,Doa memohon perlindungan dari setan,شیطان سے پناہ کی دعا,শয়তান থেকে আশ্রয়ের দোয়া,Doa memohon perlindungan dari syaitan,Rabbi aʿūdhu bika min hamazāti-sh-shayāṭīn. Wa aʿūdhu bika Rabbi ay-yaḥḍurūn.,Rabbi aʿūdhu bika min hamazāti-sh-shayāṭīn. Wa aʿūdhu bika Rabbi ay-yaḥḍurūn.,Rabbi aʿūdhu bika min hamazāti-sh-shayāṭīn. Wa aʿūdhu bika Rabbi ay-yaḥḍurūn.,Rabbi aʿūdhu bika min hamazāti-sh-shayāṭīn. Wa aʿūdhu bika Rabbi ay-yaḥḍurūn.,Rabbi aʿūdhu bika min hamazāti-sh-shayāṭīn. Wa aʿūdhu bika Rabbi ay-yaḥḍurūn.,Rabbi aʿūdhu bika min hamazāti-sh-shayāṭīn. Wa aʿūdhu bika Rabbi ay-yaḥḍurūn.,Rabbi aʿūdhu bika min hamazāti-sh-shayāṭīn. Wa aʿūdhu bika Rabbi ay-yaḥḍurūn.,"Mein Herr, ich suche Zuflucht bei Dir vor den Einflüsterungen der Satane; und ich suche Zuflucht bei Dir, mein Herr, davor, dass sie sich mir nähern.","Mijn Heer, ik zoek bij U bescherming tegen de influisteringen van de duivels; en ik zoek bij U bescherming, mijn Heer, tegen hun aanwezigheid bij mij.","Rabbim! Şeytanların kışkırtmalarından Sana sığınırım; ve onların yanımda bulunmalarından da Sana sığınırım, Rabbim.","Ya Tuhanku, aku berlindung kepada-Mu dari bisikan-bisikan setan; dan aku berlindung kepada-Mu, ya Tuhanku, agar mereka tidak mendekatiku.",اے میرے رب! میں شیطانوں کے وسوسوں سے تیری پناہ مانگتا ہوں؛ اور اے میرے رب! میں اس سے بھی تیری پناہ مانگتا ہوں کہ وہ میرے پاس آئیں۔,হে আমার রব! আমি শয়তানদের প্ররোচনা থেকে তোমার আশ্রয় চাই; আর হে আমার রব! তারা আমার নিকটে আসা থেকেও তোমার আশ্রয় চাই।,"Wahai Tuhanku! Aku berlindung kepada-Mu daripada hasutan syaitan; dan aku berlindung kepada-Mu, wahai Tuhanku, daripada kehadiran mereka di sisiku.","Zu sprechen zum Schutz vor satanischen Einflüsterungen, besonders bei Zorn, Zweifel oder bösen Eingebungen.","Te reciteren ter bescherming tegen satanische influisteringen, vooral bij woede, twijfel of kwade ingevingen.","Şeytanî vesveselerden korunmak için, özellikle öfke, şüphe ya da kötü düşünceler anında okunur.","Dibaca untuk perlindungan dari bisikan setan, terutama saat marah, ragu, atau muncul dorongan buruk.",شیطانی وسوسوں سے بچاؤ کے لیے پڑھیں، خاص طور پر غصے، شک یا برے خیالات کے وقت۔,"শয়তানি কুমন্ত্রণা থেকে রক্ষায় পড়ুন, বিশেষত রাগ, সন্দেহ বা মন্দ প্ররোচনার সময়।","Dibaca untuk perlindungan daripada bisikan syaitan, terutama ketika marah, ragu, atau timbul dorongan buruk.",Koran 23:97-98,Koran 23:97-98,Kur'an 23:97-98,Al-Qur'an 23:97-98,قرآن ۲۳:۹۷-۹۸,কুরআন ২৩:৯৭-৯৮,Al-Quran 23:97-98,,,,,,,,Мольба о защите от шайтана,Rabbi aʿūdhu bika min hamazāti-sh-shayāṭīn. Wa aʿūdhu bika Rabbi ay-yaḥḍurūn.,"Господи! Я прибегаю к Тебе от наваждений шайтанов и прибегаю к Тебе, Господи, чтобы они не приближались ко мне.","Читается для защиты от наущений шайтана, особенно при гневе, сомнении или дурных побуждениях.",Коран 23:97-98,
,رَبَّنَا اغْفِرْ لَنَا ذُنُوْبَنَا وَإِسْرَافَنَا فِيٓ أَمْرِنَا وَثَبِّتْ أَقْدَامَنَا وَانْصُرْنَا عَلَى الْقَوْمِ الْكٰفِرِيْنَ.,Rabbana-ghfir lanā dhunūbanā wa isrāfanā fī amrinā wa thabbit aqdāmanā wa-nṣurnā ʿala-l-qawmi-l-kāfirīn.,Rabbana-ghfir lanā dhunūbanā wa isrāfanā fī amrinā wa thabbit aqdāmanā wa-nṣurnā ʿala-l-qawmi-l-kāfirīn.,"Our Lord, forgive us our sins and our extravagance in our affairs. Make our feet firm, and help us against the disbelieving people.","Notre Seigneur, pardonne-nous nos péchés ainsi que nos excès dans nos affaires. Affermis nos pas et secours-nous contre les gens mécréants.","Recite in times of hardship, struggle, or trial, seeking forgiveness, steadfastness and Allah's help.","À réciter dans les épreuves, les luttes ou les difficultés, en demandant pardon, fermeté et le secours d'Allah.",يُدعى بها في أوقات الشدة والجهاد والابتلاء، طلبًا للمغفرة والثبات ونصر الله.,Qur'an 3:147,Coran 3:147,القرآن ٣:١٤٧,,,,,5,0,true,,,Du'a for Forgiveness & Victory,Invocation pour le pardon et la victoire,دعاء للمغفرة والنصر,27,Bittgebet um Vergebung und Sieg,Smeekbede om vergeving en overwinning,Bağışlanma ve zafer duası,Doa memohon ampunan dan kemenangan,مغفرت اور فتح کی دعا,ক্ষমা ও বিজয়ের দোয়া,Doa memohon keampunan dan kemenangan,Rabbana-ghfir lanā dhunūbanā wa isrāfanā fī amrinā wa thabbit aqdāmanā wa-nṣurnā ʿala-l-qawmi-l-kāfirīn.,Rabbana-ghfir lanā dhunūbanā wa isrāfanā fī amrinā wa thabbit aqdāmanā wa-nṣurnā ʿala-l-qawmi-l-kāfirīn.,Rabbana-ghfir lanā dhunūbanā wa isrāfanā fī amrinā wa thabbit aqdāmanā wa-nṣurnā ʿala-l-qawmi-l-kāfirīn.,Rabbana-ghfir lanā dhunūbanā wa isrāfanā fī amrinā wa thabbit aqdāmanā wa-nṣurnā ʿala-l-qawmi-l-kāfirīn.,Rabbana-ghfir lanā dhunūbanā wa isrāfanā fī amrinā wa thabbit aqdāmanā wa-nṣurnā ʿala-l-qawmi-l-kāfirīn.,Rabbana-ghfir lanā dhunūbanā wa isrāfanā fī amrinā wa thabbit aqdāmanā wa-nṣurnā ʿala-l-qawmi-l-kāfirīn.,Rabbana-ghfir lanā dhunūbanā wa isrāfanā fī amrinā wa thabbit aqdāmanā wa-nṣurnā ʿala-l-qawmi-l-kāfirīn.,"Unser Herr, vergib uns unsere Sünden und unsere Maßlosigkeit in unseren Angelegenheiten, festige unsere Füße und hilf uns gegen das ungläubige Volk.","Onze Heer, vergeef ons onze zonden en onze buitensporigheid in onze zaken, maak onze voeten standvastig en help ons tegen het ongelovige volk.","Rabbimiz! Günahlarımızı ve işlerimizdeki taşkınlığımızı bağışla, ayaklarımızı sağlam tut ve kâfir topluluğa karşı bize yardım et.","Ya Tuhan kami, ampunilah dosa-dosa kami dan tindakan kami yang berlebihan dalam urusan kami, teguhkanlah pendirian kami, dan tolonglah kami terhadap orang-orang kafir.",اے ہمارے رب! ہمارے گناہ اور ہمارے کاموں میں ہماری زیادتیاں بخش دے، ہمارے قدم جما دے اور کافر قوم کے مقابلے میں ہماری مدد فرما۔,"হে আমাদের রব! আমাদের পাপ ও আমাদের কাজে আমাদের সীমালঙ্ঘন ক্ষমা করো, আমাদের পা অবিচল রাখো এবং কাফির সম্প্রদায়ের বিরুদ্ধে আমাদের সাহায্য করো।","Wahai Tuhan kami, ampunilah dosa-dosa kami dan perbuatan kami yang melampau dalam urusan kami, teguhkanlah pendirian kami, dan tolonglah kami menentang kaum yang kafir.","In Zeiten von Not, Mühe oder Prüfung zu sprechen, um Vergebung, Standhaftigkeit und Allahs Hilfe zu erbitten.","Te reciteren in tijden van ontbering, strijd of beproeving, zoekend naar vergeving, standvastigheid en Allahs hulp.","Zorluk, mücadele ya da imtihan zamanlarında, bağışlanma, sebat ve Allah'ın yardımını dilemek için okunur.","Dibaca saat kesulitan, perjuangan, atau ujian, memohon ampunan, keteguhan, dan pertolongan Allah.",تنگی، جدوجہد یا آزمائش کے وقت پڑھیں، مغفرت، ثابت قدمی اور اللہ کی مدد طلب کرتے ہوئے۔,"কষ্ট, সংগ্রাম বা পরীক্ষার সময় পড়ুন, ক্ষমা, অবিচলতা ও আল্লাহর সাহায্য চেয়ে।","Dibaca ketika kesusahan, perjuangan, atau ujian, memohon keampunan, keteguhan, dan pertolongan Allah.",Koran 3:147,Koran 3:147,Kur'an 3:147,Al-Qur'an 3:147,قرآن ۳:۱۴۷,কুরআন ৩:১৪৭,Al-Quran 3:147,,,,,,,,Мольба о прощении и победе,Rabbana-ghfir lanā dhunūbanā wa isrāfanā fī amrinā wa thabbit aqdāmanā wa-nṣurnā ʿala-l-qawmi-l-kāfirīn.,"Господь наш! Прости нам наши грехи и излишества в делах наших, утверди наши стопы и помоги нам против неверующих людей.","Читается во времена тягот, борьбы или испытаний, прося прощения, стойкости и помощи Аллаха.",Коран 3:147,
,رَبَّنَآ أَفْرِغْ عَلَيْنَا صَبْرًا وَّثَبِّتْ أَقْدَامَنَا وَانْصُرْنَا عَلَى الْقَوْمِ الْكٰفِرِيْنَ.,Rabbanā afrigh ʿalaynā ṣabraw-wa thabbit aqdāmanā wa-nṣurnā ʿala-l-qawmi-l-kāfirīn.,Rabbanā afrigh ʿalaynā ṣabraw-wa thabbit aqdāmanā wa-nṣurnā ʿala-l-qawmi-l-kāfirīn.,"Our Lord, pour upon us patience, make our steps firm and grant us victory over the disbelieving people.","Notre Seigneur, déverse sur nous l'endurance, affermis nos pas et accorde-nous la victoire sur les gens mécréants.","The prayer of Talut's army; recite before facing a great challenge, seeking patience, firmness and victory.","La prière de l'armée de Talout ; à réciter avant un grand défi, en demandant patience, fermeté et victoire.",دعاء جند طالوت؛ يُقال قبل مواجهة تحدٍّ عظيم، طلبًا للصبر والثبات والنصر.,Qur'an 2:250,Coran 2:250,القرآن ٢:٢٥٠,,,,,5,0,true,,,Du'a for Firmness & Victory,Invocation pour la fermeté et la victoire,دعاء للثبات والنصر,28,Bittgebet um Standhaftigkeit und Sieg,Smeekbede om standvastigheid en overwinning,Sebat ve zafer duası,Doa memohon keteguhan dan kemenangan,ثابت قدمی اور فتح کی دعا,অবিচলতা ও বিজয়ের দোয়া,Doa memohon keteguhan dan kemenangan,Rabbanā afrigh ʿalaynā ṣabraw-wa thabbit aqdāmanā wa-nṣurnā ʿala-l-qawmi-l-kāfirīn.,Rabbanā afrigh ʿalaynā ṣabraw-wa thabbit aqdāmanā wa-nṣurnā ʿala-l-qawmi-l-kāfirīn.,Rabbanā afrigh ʿalaynā ṣabraw-wa thabbit aqdāmanā wa-nṣurnā ʿala-l-qawmi-l-kāfirīn.,Rabbanā afrigh ʿalaynā ṣabraw-wa thabbit aqdāmanā wa-nṣurnā ʿala-l-qawmi-l-kāfirīn.,Rabbanā afrigh ʿalaynā ṣabraw-wa thabbit aqdāmanā wa-nṣurnā ʿala-l-qawmi-l-kāfirīn.,Rabbanā afrigh ʿalaynā ṣabraw-wa thabbit aqdāmanā wa-nṣurnā ʿala-l-qawmi-l-kāfirīn.,Rabbanā afrigh ʿalaynā ṣabraw-wa thabbit aqdāmanā wa-nṣurnā ʿala-l-qawmi-l-kāfirīn.,"Unser Herr, überschütte uns mit Geduld, festige unsere Füße und verhilf uns zum Sieg über das ungläubige Volk.","Onze Heer, stort geduld over ons uit, maak onze voeten standvastig en schenk ons de overwinning over het ongelovige volk.","Rabbimiz! Üzerimize sabır yağdır, ayaklarımızı sağlam tut ve kâfir topluluğa karşı bize zafer ver.","Ya Tuhan kami, limpahkanlah kesabaran kepada kami, teguhkanlah langkah kami, dan menangkanlah kami terhadap orang-orang kafir.",اے ہمارے رب! ہم پر صبر انڈیل دے، ہمارے قدم جما دے اور کافر قوم پر ہمیں فتح عطا فرما۔,"হে আমাদের রব! আমাদের উপর ধৈর্য ঢেলে দাও, আমাদের পা অবিচল রাখো এবং কাফির সম্প্রদায়ের বিরুদ্ধে আমাদের বিজয় দান করো।","Wahai Tuhan kami, limpahkanlah kesabaran ke atas kami, teguhkanlah pendirian kami, dan menangkanlah kami menentang kaum yang kafir.","Das Gebet von Taluts Heer; vor einer großen Herausforderung zu sprechen, um Geduld, Festigkeit und Sieg zu erbitten.","Het gebed van Taluts leger; te reciteren voor een grote uitdaging, zoekend naar geduld, standvastigheid en overwinning.","Talut ordusunun duası; büyük bir sınavla karşılaşmadan önce sabır, sebat ve zafer dilemek için okunur.","Doa pasukan Talut; dibaca sebelum menghadapi tantangan besar, memohon kesabaran, keteguhan, dan kemenangan.",طالوت کے لشکر کی دعا؛ کسی بڑے امتحان سے پہلے صبر، ثابت قدمی اور فتح کے لیے پڑھیں۔,"তালুতের বাহিনীর দোয়া; বড় চ্যালেঞ্জের আগে ধৈর্য, অবিচলতা ও বিজয় চেয়ে পড়ুন।","Doa tentera Talut; dibaca sebelum menghadapi cabaran besar, memohon kesabaran, keteguhan, dan kemenangan.",Koran 2:250,Koran 2:250,Kur'an 2:250,Al-Qur'an 2:250,قرآن ۲:۲۵۰,কুরআন ২:২৫০,Al-Quran 2:250,,,,,,,,Мольба о стойкости и победе,Rabbanā afrigh ʿalaynā ṣabraw-wa thabbit aqdāmanā wa-nṣurnā ʿala-l-qawmi-l-kāfirīn.,"Господь наш! Излей на нас терпение, утверди наши стопы и помоги нам одержать победу над неверующими людьми.","Мольба войска Талута; читается перед большим испытанием, прося терпения, стойкости и победы.",Коран 2:250,
