id,arabic_text,transcription_en,transcription_fr,translation_en,translation_fr,when_en,when_fr,when_ar,reference_en,reference_fr,reference_ar,tafsir_en,tafsir_fr,tafsir_ar,audio_url,ajr,likes_count,is_active,created_at,updated_at,title_en,title_fr,title_ar,position,title_de,title_nl,title_tr,title_id,title_ur,title_bn,title_ms,transcription_de,transcription_nl,transcription_tr,transcription_id,transcription_ur,transcription_bn,transcription_ms,translation_de,translation_nl,translation_tr,translation_id,translation_ur,translation_bn,translation_ms,when_de,when_nl,when_tr,when_id,when_ur,when_bn,when_ms,reference_de,reference_nl,reference_tr,reference_id,reference_ur,reference_bn,reference_ms,tafsir_de,tafsir_nl,tafsir_tr,tafsir_id,tafsir_ur,tafsir_bn,tafsir_ms,title_ru,transcription_ru,translation_ru,when_ru,reference_ru,tafsir_ru
,رَبِّ اشْرَحْ لِيْ صَدْرِيْ ، وَيَسِّرْ لِيْٓ أَمْرِيْ.,Rabbi-shraḥ lī ṣadrī wa yassir lī amrī.,Rabbi-shraḥ lī ṣadrī wa yassir lī amrī.,"My Lord, put my heart at peace for me, and make my task easy for me.","Mon Seigneur, ouvre-moi ma poitrine, et facilite ma mission.","Recite before any daunting task, public speaking, or difficult undertaking, seeking calm and ease.","À réciter avant toute tâche intimidante, prise de parole en public ou entreprise difficile, en demandant calme et facilité.",يُدعى بها قبل أي مهمة صعبة أو خطابة أو أمر شاق، طلبًا للطمأنينة والتيسير.,Qur'an 20:25-26,Coran 20:25-26,القرآن ٢٠:٢٥-٢٦,,,,,5,0,true,,,Du'a of Prophet Musa ﷺ for Inner Peace & Strength,Invocation du Prophète Musa ﷺ pour la paix intérieure et la force,دعاء النبي موسى عليه السلام لانشراح الصدر والقوة,19,Bittgebet des Propheten Musa ﷺ um inneren Frieden und Kraft,Smeekbede van profeet Musa ﷺ om innerlijke rust en kracht,Peygamber Musa'nın ﷺ iç huzur ve güç duası,Doa Nabi Musa ﷺ memohon ketenangan dan kekuatan,نبی موسیٰ علیہ السلام کی دل کے سکون اور قوت کی دعا,নবী মূসা ﷺ-এর অন্তরের প্রশান্তি ও শক্তির দোয়া,Doa Nabi Musa ﷺ memohon ketenangan dan kekuatan,Rabbi-shraḥ lī ṣadrī wa yassir lī amrī.,Rabbi-shraḥ lī ṣadrī wa yassir lī amrī.,Rabbi-shraḥ lī ṣadrī wa yassir lī amrī.,Rabbi-shraḥ lī ṣadrī wa yassir lī amrī.,Rabbi-shraḥ lī ṣadrī wa yassir lī amrī.,Rabbi-shraḥ lī ṣadrī wa yassir lī amrī.,Rabbi-shraḥ lī ṣadrī wa yassir lī amrī.,"Mein Herr, weite mir meine Brust und mache mir meine Aufgabe leicht.","Mijn Heer, verruim mijn borst voor mij en maak mijn taak voor mij gemakkelijk.",Rabbim! Gönlüme ferahlık ver ve işimi kolaylaştır.,"Ya Tuhanku, lapangkanlah dadaku, dan mudahkanlah urusanku.",اے میرے رب! میرے لیے میرا سینہ کھول دے، اور میرا کام میرے لیے آسان کر دے۔,হে আমার রব! আমার বুক প্রশস্ত করে দাও এবং আমার কাজ সহজ করে দাও।,"Wahai Tuhanku! Lapangkanlah dadaku, dan mudahkanlah urusanku.","Vor jeder einschüchternden Aufgabe, Rede oder schwierigem Vorhaben zu sprechen, um Ruhe und Erleichterung zu erbitten.","Te reciteren voor elke ontmoedigende taak, het spreken in het openbaar of een moeilijke onderneming, zoekend naar kalmte en gemak.","Zorlu bir görev, topluluk önünde konuşma ya da güç bir işten önce, huzur ve kolaylık dilemek için okunur.","Dibaca sebelum tugas yang berat, berbicara di depan umum, atau urusan sulit, memohon ketenangan dan kemudahan.",کسی مشکل کام، تقریر یا دشوار معاملے سے پہلے پڑھیں، سکون اور آسانی طلب کرتے ہوئے۔,"কোনো কঠিন কাজ, জনসমক্ষে বক্তব্য বা দুরূহ কাজের আগে পড়ুন, প্রশান্তি ও সহজতা চেয়ে।","Dibaca sebelum tugas yang sukar, berucap di khalayak, atau urusan yang berat, memohon ketenangan dan kemudahan.",Koran 20:25-26,Koran 20:25-26,Kur'an 20:25-26,Al-Qur'an 20:25-26,قرآن ۲۰:۲۵-۲۶,কুরআন ২০:২৫-২৬,Al-Quran 20:25-26,,,,,,,,Мольба пророка Мусы ﷺ о внутреннем покое и силе,Rabbi-shraḥ lī ṣadrī wa yassir lī amrī.,Господи! Раскрой для меня мою грудь и облегчи мою задачу.,"Читается перед трудной задачей, выступлением или сложным делом, прося спокойствия и облегчения.",Коран 20:25-26,
,رَبِّ اجْعَلْنِيْ مُقِيْمَ الصَّلَاةِ وَمِنْ ذُرِّيَّتِيْ ، رَبَّنَا وَتَقَبَّلْ دُعَآءِ. رَبَّنَا اغْفِرْ لِيْ وَلِوَالِدَيَّ وَلِلْمُؤْمِنِيْنَ يَوْمَ يَقُوْمُ الْحِسَابُ.,Rabbij-ʿalnī muqīma-ṣ-ṣalāti wa min dhurriyyatī Rabbanā wa taqabbal duʿā'. Rabbana-ghfir lī wa li-wālidayya wa lil-mu'minīna yawma yaqūmu-l-ḥisāb.,Rabbij-ʿalnī muqīma-ṣ-ṣalāti wa min dhurriyyatī Rabbanā wa taqabbal duʿā'. Rabbana-ghfir lī wa li-wālidayya wa lil-mu'minīna yawma yaqūmu-l-ḥisāb.,"My Lord, make me steadfast in salah, and my offspring as well. Our Lord, accept my prayer. Our Lord, forgive me, my parents, and all the believers on the Day when the Reckoning will take place.","Mon Seigneur, fais que j'accomplisse assidûment la prière, ainsi qu'une partie de ma descendance. Notre Seigneur, accepte mon invocation. Notre Seigneur, pardonne-moi, ainsi qu'à mes parents et aux croyants, le Jour où aura lieu le règlement des comptes.","Recite for steadfastness in prayer for yourself and your children, and forgiveness for you, your parents, and the believers.","À réciter pour l'assiduité dans la prière pour soi et ses enfants, et le pardon pour soi, ses parents et les croyants.",يُدعى بها للمداومة على الصلاة للنفس والذرية، وللمغفرة للعبد ووالديه والمؤمنين.,Qur'an 14:40-41,Coran 14:40-41,القرآن ١٤:٤٠-٤١,,,,,5,0,true,,,Du'a of Prophet Ibrahim ﷺ for His Progeny & Parents,Invocation du Prophète Ibrahim ﷺ pour sa descendance et ses parents,دعاء النبي إبراهيم عليه السلام لذريته ووالديه,20,Bittgebet des Propheten Ibrahim ﷺ für seine Nachkommen und Eltern,Smeekbede van profeet Ibrahim ﷺ voor zijn nageslacht en ouders,Peygamber İbrahim'in ﷺ zürriyeti ve ana-babası için duası,Doa Nabi Ibrahim ﷺ untuk keturunan dan kedua orang tuanya,نبی ابراہیم علیہ السلام کی اپنی اولاد اور والدین کے لیے دعا,নবী ইব্রাহিম ﷺ-এর সন্তান ও পিতামাতার জন্য দোয়া,Doa Nabi Ibrahim ﷺ untuk zuriat dan kedua ibu bapanya,Rabbij-ʿalnī muqīma-ṣ-ṣalāti wa min dhurriyyatī Rabbanā wa taqabbal duʿā'. Rabbana-ghfir lī wa li-wālidayya wa lil-mu'minīna yawma yaqūmu-l-ḥisāb.,Rabbij-ʿalnī muqīma-ṣ-ṣalāti wa min dhurriyyatī Rabbanā wa taqabbal duʿā'. Rabbana-ghfir lī wa li-wālidayya wa lil-mu'minīna yawma yaqūmu-l-ḥisāb.,Rabbij-ʿalnī muqīma-ṣ-ṣalāti wa min dhurriyyatī Rabbanā wa taqabbal duʿā'. Rabbana-ghfir lī wa li-wālidayya wa lil-mu'minīna yawma yaqūmu-l-ḥisāb.,Rabbij-ʿalnī muqīma-ṣ-ṣalāti wa min dhurriyyatī Rabbanā wa taqabbal duʿā'. Rabbana-ghfir lī wa li-wālidayya wa lil-mu'minīna yawma yaqūmu-l-ḥisāb.,Rabbij-ʿalnī muqīma-ṣ-ṣalāti wa min dhurriyyatī Rabbanā wa taqabbal duʿā'. Rabbana-ghfir lī wa li-wālidayya wa lil-mu'minīna yawma yaqūmu-l-ḥisāb.,Rabbij-ʿalnī muqīma-ṣ-ṣalāti wa min dhurriyyatī Rabbanā wa taqabbal duʿā'. Rabbana-ghfir lī wa li-wālidayya wa lil-mu'minīna yawma yaqūmu-l-ḥisāb.,Rabbij-ʿalnī muqīma-ṣ-ṣalāti wa min dhurriyyatī Rabbanā wa taqabbal duʿā'. Rabbana-ghfir lī wa li-wālidayya wa lil-mu'minīna yawma yaqūmu-l-ḥisāb.,"Mein Herr, lass mich das Gebet verrichten, und auch (einen Teil) meiner Nachkommenschaft. Unser Herr, nimm mein Bittgebet an. Unser Herr, vergib mir, meinen Eltern und den Gläubigen am Tag, an dem die Abrechnung stattfindet.","Mijn Heer, maak mij standvastig in het gebed, en ook mijn nageslacht. Onze Heer, aanvaard mijn smeekbede. Onze Heer, vergeef mij, mijn ouders en de gelovigen op de Dag waarop de Afrekening plaatsvindt.","Rabbim! Beni namazı dosdoğru kılan biri eyle, soyumdan da. Rabbimiz! Duamı kabul et. Rabbimiz! Hesabın görüleceği gün beni, ana-babamı ve müminleri bağışla.","Ya Tuhanku, jadikanlah aku dan anak cucuku orang-orang yang tetap mendirikan salat. Ya Tuhan kami, perkenankanlah doaku. Ya Tuhan kami, ampunilah aku dan kedua orang tuaku serta semua orang beriman pada hari diadakannya perhitungan.",اے میرے رب! مجھے اور میری اولاد کو نماز قائم کرنے والا بنا۔ اے ہمارے رب! میری دعا قبول فرما۔ اے ہمارے رب! مجھے، میرے والدین کو اور سب مومنوں کو اُس دن بخش دے جس دن حساب قائم ہوگا۔,"হে আমার রব! আমাকে ও আমার সন্তানদের সালাত কায়েমকারী বানাও। হে আমাদের রব! আমার দোয়া কবুল করো। হে আমাদের রব! যেদিন হিসাব কায়েম হবে সেদিন আমাকে, আমার পিতামাতাকে ও সকল মুমিনকে ক্ষমা করো।","Wahai Tuhanku! Jadikanlah aku dan zuriatku orang yang mendirikan solat. Wahai Tuhan kami, perkenankanlah doaku. Wahai Tuhan kami, ampunilah aku, kedua ibu bapaku dan sekalian orang beriman pada hari berlakunya hitungan amal.","Zu sprechen für Beständigkeit im Gebet für sich und seine Kinder sowie Vergebung für sich, seine Eltern und die Gläubigen.","Te reciteren voor standvastigheid in het gebed voor jezelf en je kinderen, en vergeving voor jou, je ouders en de gelovigen.","Kendin ve çocukların için namazda devamlılık, kendin, ana-baban ve müminler için bağışlanma dilemek için okunur.","Dibaca untuk keistikamahan salat bagi diri dan anak-anak, serta ampunan bagi diri, orang tua, dan orang beriman.",اپنے اور اپنی اولاد کی نماز پر پابندی، اور اپنے، والدین اور مومنوں کی مغفرت کے لیے پڑھیں۔,"নিজের ও সন্তানদের সালাতে অবিচলতা এবং নিজের, পিতামাতা ও মুমিনদের ক্ষমার জন্য পড়ুন।","Dibaca untuk keistiqamahan solat bagi diri dan anak-anak, serta keampunan bagi diri, ibu bapa, dan orang beriman.",Koran 14:40-41,Koran 14:40-41,Kur'an 14:40-41,Al-Qur'an 14:40-41,قرآن ۱۴:۴۰-۴۱,কুরআন ১৪:৪০-৪১,Al-Quran 14:40-41,,,,,,,,Мольба пророка Ибрахима ﷺ о потомстве и родителях,Rabbij-ʿalnī muqīma-ṣ-ṣalāti wa min dhurriyyatī Rabbanā wa taqabbal duʿā'. Rabbana-ghfir lī wa li-wālidayya wa lil-mu'minīna yawma yaqūmu-l-ḥisāb.,"Господи! Сделай меня и часть моего потомства совершающими молитву. Господь наш! Прими мою мольбу. Господь наш! Прости меня, моих родителей и верующих в День, когда наступит расчёт.","Читается ради постоянства в молитве для себя и детей и прощения для себя, родителей и верующих.",Коран 14:40-41,
,رَبِّ ارْحَمْهُمَا كَمَا رَبَّيَانِيْ صَغِيْرًا.,Rabbi-rḥamhumā kamā rabbayānī ṣaghīrā.,Rabbi-rḥamhumā kamā rabbayānī ṣaghīrā.,"My Lord, have mercy upon them (my parents) as they raised and nurtured me when I was young.","Mon Seigneur, fais-leur (à mes parents) miséricorde comme ils m'ont élevé tout petit.","Recite regularly for your parents, whether living or deceased, asking Allah's mercy upon them.","À réciter régulièrement pour ses parents, vivants ou décédés, en demandant la miséricorde d'Allah sur eux.",يُدعى بها للوالدين باستمرار، أحياءً كانوا أم أمواتًا، طلبًا لرحمة الله بهما.,Qur'an 17:24,Coran 17:24,القرآن ١٧:٢٤,,,,,5,0,true,,,Du'a for Parents,Invocation pour les parents,دعاء للوالدين,21,Bittgebet für die Eltern,Smeekbede voor de ouders,Ana-baba için dua,Doa untuk kedua orang tua,والدین کے لیے دعا,পিতামাতার জন্য দোয়া,Doa untuk kedua ibu bapa,Rabbi-rḥamhumā kamā rabbayānī ṣaghīrā.,Rabbi-rḥamhumā kamā rabbayānī ṣaghīrā.,Rabbi-rḥamhumā kamā rabbayānī ṣaghīrā.,Rabbi-rḥamhumā kamā rabbayānī ṣaghīrā.,Rabbi-rḥamhumā kamā rabbayānī ṣaghīrā.,Rabbi-rḥamhumā kamā rabbayānī ṣaghīrā.,Rabbi-rḥamhumā kamā rabbayānī ṣaghīrā.,"Mein Herr, erbarme Dich ihrer (meiner Eltern), wie sie mich aufgezogen haben, als ich klein war.","Mijn Heer, ontferm U over hen (mijn ouders) zoals zij mij hebben grootgebracht toen ik klein was.","Rabbim! Onlar (ana-babam) beni küçükken nasıl yetiştirdilerse, Sen de onlara öyle merhamet et.","Ya Tuhanku, sayangilah keduanya (orang tuaku) sebagaimana mereka mendidikku waktu kecil.",اے میرے رب! اُن (میرے والدین) پر رحم فرما جیسے انہوں نے بچپن میں مجھے پالا۔,হে আমার রব! তাদের (আমার পিতামাতার) প্রতি দয়া করো যেমন তারা শৈশবে আমাকে লালন-পালন করেছেন।,Wahai Tuhanku! Kasihanilah keduanya (ibu bapaku) sebagaimana mereka mendidikku semasa kecil.,"Regelmäßig für die Eltern zu sprechen, ob lebend oder verstorben, um Allahs Barmherzigkeit für sie zu erbitten.","Regelmatig te reciteren voor je ouders, levend of overleden, vragend om Allahs genade voor hen.",Hayatta ya da vefat etmiş ana-baban için Allah'ın rahmetini dileyerek düzenli okunur.,"Dibaca secara rutin untuk kedua orang tua, baik yang masih hidup maupun telah wafat, memohon rahmat Allah bagi mereka.",اپنے والدین کے لیے، زندہ ہوں یا فوت شدہ، باقاعدگی سے اللہ کی رحمت مانگتے ہوئے پڑھیں۔,"জীবিত বা মৃত পিতামাতার জন্য নিয়মিত পড়ুন, তাদের উপর আল্লাহর রহমত চেয়ে।","Dibaca secara berkala untuk kedua ibu bapa, sama ada masih hidup atau telah meninggal, memohon rahmat Allah bagi mereka.",Koran 17:24,Koran 17:24,Kur'an 17:24,Al-Qur'an 17:24,قرآن ۱۷:۲۴,কুরআন ১৭:২৪,Al-Quran 17:24,,,,,,,,Мольба за родителей,Rabbi-rḥamhumā kamā rabbayānī ṣaghīrā.,"Господи! Помилуй их (моих родителей), как они растили меня ребёнком.","Читается регулярно за родителей, живых или усопших, прося для них милости Аллаха.",Коран 17:24,
,رَبِّ هَبْ لِيْ مِنْ لَّدُنْكَ ذُرِّيَّةً طَيِّبَةً ، إِنَّكَ سَمِيْعُ الدُّعَآءِ.,"Rabbi hab lī mil-ladunka dhurriyyatan ṭayyibah, innaka samīʿu-d-duʿā'.","Rabbi hab lī mil-ladunka dhurriyyatan ṭayyibah, innaka samīʿu-d-duʿā'.","My Lord, grant me from Yourself pious offspring. Indeed, You hear all prayers.","Mon Seigneur, accorde-moi de Ta part une descendance pieuse. Tu es vraiment Celui qui entend l'invocation.",Recite when hoping for righteous children; the supplication of Zakariyya ﷺ that was answered with Yahya ﷺ.,À réciter en espérant une descendance vertueuse ; l'invocation de Zakariyya ﷺ exaucée par Yahya ﷺ.,يُدعى بها عند الرغبة في ذرية صالحة؛ دعوة زكريا عليه السلام التي استُجيبت بيحيى عليه السلام.,Qur'an 3:38,Coran 3:38,القرآن ٣:٣٨,,,,,5,0,true,,,Du'a of Zakariyya ﷺ for Pious Children,Invocation de Zakariyya ﷺ pour une descendance pieuse,دعاء زكريا عليه السلام للذرية الطيبة,22,Bittgebet Zakariyyas ﷺ um fromme Kinder,Smeekbede van Zakariyya ﷺ om vroom nageslacht,Zekeriya'nın ﷺ hayırlı evlat duası,Doa Zakariya ﷺ memohon keturunan yang saleh,زکریا علیہ السلام کی نیک اولاد کی دعا,যাকারিয়া ﷺ-এর নেক সন্তানের দোয়া,Doa Zakaria ﷺ memohon zuriat yang soleh,"Rabbi hab lī mil-ladunka dhurriyyatan ṭayyibah, innaka samīʿu-d-duʿā'.","Rabbi hab lī mil-ladunka dhurriyyatan ṭayyibah, innaka samīʿu-d-duʿā'.","Rabbi hab lī mil-ladunka dhurriyyatan ṭayyibah, innaka samīʿu-d-duʿā'.","Rabbi hab lī mil-ladunka dhurriyyatan ṭayyibah, innaka samīʿu-d-duʿā'.","Rabbi hab lī mil-ladunka dhurriyyatan ṭayyibah, innaka samīʿu-d-duʿā'.","Rabbi hab lī mil-ladunka dhurriyyatan ṭayyibah, innaka samīʿu-d-duʿā'.","Rabbi hab lī mil-ladunka dhurriyyatan ṭayyibah, innaka samīʿu-d-duʿā'.","Mein Herr, schenke mir von Dir aus eine gute Nachkommenschaft. Du bist gewiss der Erhörer des Bittgebets.","Mijn Heer, schenk mij van Uw kant goed nageslacht. Voorwaar, U bent de Verhoorder van de smeekbede.",Rabbim! Bana katından hayırlı bir nesil bağışla. Şüphesiz Sen duayı işitensin.,"Ya Tuhanku, berilah aku dari sisi-Mu keturunan yang baik. Sesungguhnya Engkau Maha Mendengar doa.",اے میرے رب! مجھے اپنے پاس سے پاکیزہ اولاد عطا فرما، بے شک تو دعا سننے والا ہے۔,হে আমার রব! তোমার পক্ষ থেকে আমাকে পবিত্র সন্তান দান করো; নিশ্চয়ই তুমি দোয়া শ্রবণকারী।,Wahai Tuhanku! Kurniakanlah kepadaku dari sisi-Mu zuriat yang baik. Sesungguhnya Engkau Maha Mendengar doa.,"Zu sprechen in der Hoffnung auf rechtschaffene Kinder; das Bittgebet Zakariyyas ﷺ, das mit Yahya ﷺ erhört wurde.",Te reciteren in de hoop op vroom nageslacht; de smeekbede van Zakariyya ﷺ die met Yahya ﷺ werd verhoord.,Salih evlat ümit ederken okunur; Zekeriya'nın ﷺ Yahya ﷺ ile kabul olunan duası.,Dibaca saat mengharapkan anak yang saleh; doa Zakariya ﷺ yang dikabulkan dengan kelahiran Yahya ﷺ.,نیک اولاد کی امید میں پڑھیں؛ زکریا علیہ السلام کی وہ دعا جو یحییٰ علیہ السلام کی صورت میں قبول ہوئی۔,নেক সন্তানের আশায় পড়ুন; যাকারিয়া ﷺ-এর এই দোয়া ইয়াহইয়া ﷺ-এর মাধ্যমে কবুল হয়েছিল।,Dibaca ketika mengharapkan anak yang soleh; doa Zakaria ﷺ yang dimakbulkan dengan kelahiran Yahya ﷺ.,Koran 3:38,Koran 3:38,Kur'an 3:38,Al-Qur'an 3:38,قرآن ۳:۳۸,কুরআন ৩:৩৮,Al-Quran 3:38,,,,,,,,Мольба Закарии ﷺ о праведном потомстве,"Rabbi hab lī mil-ladunka dhurriyyatan ṭayyibah, innaka samīʿu-d-duʿā'.","Господи! Даруй мне от Себя благое потомство. Воистину, Ты внимаешь мольбе.","Читается в надежде на праведных детей; мольба Закарии ﷺ, отвеченная рождением Яхьи ﷺ.",Коран 3:38,
,رَبِّ هَبْ لِيْ مِنَ الصَّالِحِيْنَ.,Rabbi hab lī mina-ṣ-ṣāliḥīn.,Rabbi hab lī mina-ṣ-ṣāliḥīn.,"My Lord, grant me (offspring) from amongst the righteous.","Mon Seigneur, accorde-moi (une descendance) parmi les vertueux.",Recite hoping for righteous offspring; the supplication of Ibrahim ﷺ answered with Ismaʿil ﷺ.,À réciter en espérant une descendance vertueuse ; l'invocation d'Ibrahim ﷺ exaucée par Ismaʿil ﷺ.,يُدعى بها رجاء ذرية صالحة؛ دعوة إبراهيم عليه السلام التي استُجيبت بإسماعيل عليه السلام.,Qur'an 37:100,Coran 37:100,القرآن ٣٧:١٠٠,,,,,5,0,true,,,Du'a of Ibrahim ﷺ for Pious Children,Invocation d'Ibrahim ﷺ pour une descendance pieuse,دعاء إبراهيم عليه السلام للذرية الصالحة,23,Bittgebet Ibrahims ﷺ um rechtschaffene Kinder,Smeekbede van Ibrahim ﷺ om vroom nageslacht,İbrahim'in ﷺ salih evlat duası,Doa Ibrahim ﷺ memohon keturunan yang saleh,ابراہیم علیہ السلام کی نیک اولاد کی دعا,ইব্রাহিম ﷺ-এর নেক সন্তানের দোয়া,Doa Ibrahim ﷺ memohon zuriat yang soleh,Rabbi hab lī mina-ṣ-ṣāliḥīn.,Rabbi hab lī mina-ṣ-ṣāliḥīn.,Rabbi hab lī mina-ṣ-ṣāliḥīn.,Rabbi hab lī mina-ṣ-ṣāliḥīn.,Rabbi hab lī mina-ṣ-ṣāliḥīn.,Rabbi hab lī mina-ṣ-ṣāliḥīn.,Rabbi hab lī mina-ṣ-ṣāliḥīn.,"Mein Herr, schenke mir (Nachkommenschaft) von den Rechtschaffenen.","Mijn Heer, schenk mij (nageslacht) onder de oprechten.",Rabbim! Bana salihlerden (bir evlat) bağışla.,"Ya Tuhanku, anugerahkanlah kepadaku (anak) yang termasuk orang-orang saleh.",اے میرے رب! مجھے نیک لوگوں میں سے (اولاد) عطا فرما۔,হে আমার রব! আমাকে সৎকর্মশীলদের অন্তর্ভুক্ত (সন্তান) দান করো।,Wahai Tuhanku! Kurniakanlah kepadaku (anak) daripada kalangan orang yang soleh.,"Zu sprechen in der Hoffnung auf rechtschaffene Nachkommen; das Bittgebet Ibrahims ﷺ, erhört mit Ismaʿil ﷺ.",Te reciteren in de hoop op vroom nageslacht; de smeekbede van Ibrahim ﷺ verhoord met Ismaʿil ﷺ.,Salih evlat ümit ederek okunur; İbrahim'in ﷺ İsmail ﷺ ile kabul olunan duası.,Dibaca mengharapkan keturunan yang saleh; doa Ibrahim ﷺ yang dikabulkan dengan Ismail ﷺ.,نیک اولاد کی امید میں پڑھیں؛ ابراہیم علیہ السلام کی وہ دعا جو اسماعیل علیہ السلام کی صورت میں قبول ہوئی۔,নেক সন্তানের আশায় পড়ুন; ইব্রাহিম ﷺ-এর এই দোয়া ইসমাইল ﷺ-এর মাধ্যমে কবুল হয়েছিল।,Dibaca mengharapkan zuriat yang soleh; doa Ibrahim ﷺ yang dimakbulkan dengan Ismail ﷺ.,Koran 37:100,Koran 37:100,Kur'an 37:100,Al-Qur'an 37:100,قرآن ۳۷:۱۰۰,কুরআন ৩৭:১০০,Al-Quran 37:100,,,,,,,,Мольба Ибрахима ﷺ о праведных детях,Rabbi hab lī mina-ṣ-ṣāliḥīn.,Господи! Даруй мне (потомство) из числа праведников.,"Читается в надежде на праведное потомство; мольба Ибрахима ﷺ, отвеченная рождением Исмаила ﷺ.",Коран 37:100,
